{
  "$schema": "https://json-schema.org/draft/2020-12/schema",
  "$id": "https://aiathumanscale.com/schemas/subject-profile.schema.json",
  "title": "Subject Profile",
  "type": "object",
  "required": ["record_type", "id", "title", "facts", "profile_owner", "updated_at"],
  "properties": {
    "record_type": {"const": "subject_profile"},
    "id": {"$ref": "common.schema.json#/$defs/identifier"},
    "title": {"type": "string", "minLength": 3},
    "facts": {
      "type": "object",
      "minProperties": 1,
      "additionalProperties": {"type": ["string", "number", "boolean", "array", "null"]}
    },
    "profile_owner": {"type": "string", "minLength": 1},
    "updated_at": {"type": "string", "format": "date-time"},
    "notes": {"type": ["string", "null"]}
  },
  "additionalProperties": false
}
